{
  "$schema": "https://json-schema.org/draft/2020-12/schema",
  "$id": "https://sacsi.com.ar/schemas/schema_solucion.json",
  "title": "Solucion",
  "description": "Un paquete de solución (servicio comercial). Incluye pricing, estimación de horas y flujo de ejecución detallado.",
  "type": "object",
  "required": [
    "id",
    "nombre",
    "categorias",
    "precioMin",
    "precioMax",
    "horasMin",
    "horasMax",
    "costoFijo",
    "descripcion_publica",
    "flujo"
  ],
  "properties": {
    "id": {
      "type": "string",
      "description": "Identificador único de la solución. Usado en URLs: /soluciones/<id>/.",
      "examples": [
        "diagnostico-ia",
        "ia-esencial",
        "ia-avanzada",
        "landing",
        "sitio-pro",
        "ecommerce",
        "ret-basico",
        "ret-pro",
        "soft-grande"
      ]
    },
    "nombre": {
      "type": "string",
      "description": "Nombre legible de la solución."
    },
    "categorias": {
      "type": "array",
      "description": "Lista de refs 'servicio/categoria' a las que aplica esta solución.",
      "items": {
        "type": "string"
      },
      "minItems": 1,
      "examples": [
        "presencia-online/sitio-web-institucional",
        "automatizacion/facturacion-cobranzas"
      ]
    },
    "precioMin": {
      "type": "number",
      "description": "Precio mínimo en ARS k (miles).",
      "minimum": 0
    },
    "precioMax": {
      "type": "number",
      "description": "Precio máximo en ARS k (miles).",
      "minimum": 0
    },
    "horasMin": {
      "type": "number",
      "description": "Horas mínimas estimadas.",
      "minimum": 0
    },
    "horasMax": {
      "type": "number",
      "description": "Horas máximas estimadas.",
      "minimum": 0
    },
    "costoFijo": {
      "type": "number",
      "description": "Costo fijo asociado (ARS k). Default: 0.",
      "default": 0
    },
    "flujo": {
      "type": "array",
      "description": "Pasos secuenciales del flujo de la solución.",
      "items": {
        "type": "object",
        "required": [
          "orden",
          "paso",
          "entradas",
          "salidas",
          "descripcion",
          "horas"
        ],
        "properties": {
          "orden": {
            "type": "integer",
            "minimum": 1
          },
          "paso": {
            "type": "string"
          },
          "entradas": {
            "type": "string"
          },
          "salidas": {
            "type": "string"
          },
          "descripcion": {
            "type": "string"
          },
          "horas": {
            "type": "number",
            "minimum": 0
          }
        },
        "additionalProperties": false
      }
    },
    "descripcion_publica": {
      "type": "string",
      "description": "Copy público orientado al beneficio del cliente."
    },
    "nota_interna_pricing": {
      "type": "string",
      "description": "Nota interna sobre fijación de precios o márgenes."
    },
    "recibis": {
      "type": "string",
      "description": "Lista de entregables en lenguaje cliente para la sección pública 'Recibís'."
    },
    "necesitamos": {
      "type": "string",
      "description": "Lista de requerimientos en lenguaje cliente para la sección pública 'Qué necesitamos de vos'."
    }
  },
  "additionalProperties": false
}
