{
  "id": "hora-tec",
  "nombre": "Hora técnica",
  "categorias": [
    "sistemas-gestion",
    "integraciones"
  ],
  "precioMin": 30,
  "precioMax": 45,
  "horasMin": 1,
  "horasMax": 1,
  "costoFijo": 0,
  "flujo": [
    {
      "orden": 1,
      "paso": "Sesión técnica",
      "entradas": "Pedido puntual del cliente",
      "salidas": "Problema resuelto / tarea completada / recomendación",
      "descripcion": "Hora de consultoría o desarrollo puntual: se resuelve el tema y se entrega el resultado o recomendación",
      "horas": 1
    }
  ],
  "descripcion_publica": "",
  "nota_interna_pricing": "",
  "recibis": "Sesión realizada: problema resuelto o recomendación documentada para aplicar.",
  "necesitamos": "Nos contás el problema técnico puntual y el acceso necesario para revisarlo."
}
